ID,keyline,description
550e8400-e29b-41d4-a716-446655440010,"An epic journey through uncharted territories","This book explores the unknown and takes readers on a grand adventure."
550e8400-e29b-41d4-a716-446655440011,"A comprehensive guide to SAP","Detailed explanations and examples for mastering SAP."
550e8400-e29b-41d4-a716-446655440012,"Fundamentals of programming languages","Introduction to programming concepts and languages."
550e8400-e29b-41d4-a716-446655440013,"A look into historical events and their impact","Examines significant historical events and their repercussions."
550e8400-e29b-41d4-a716-446655440014,"Delicious recipes from around the world","A collection of recipes that brings global cuisine to your kitchen."
550e8400-e29b-41d4-a716-446655440015,"Strategies for financial growth and security","Practical advice and strategies for managing and growing your finances."
550e8400-e29b-41d4-a716-446655440016,"Exploring futuristic worlds and technologies","Science fiction stories that delve into speculative technologies and future societies."
